{
  "apiVersion": "enterprise-profile/v1",
  "kind": "EnterpriseProfile",
  "metadata": {
    "id": "yashandb",
    "enterpriseId": "yashandb",
    "version": "1.0.0",
    "displayName": "YashanDB 企业能力包",
    "language": "zh-CN"
  },
  "brand": {
    "platformName": "知识中心建设平台",
    "enterpriseName": "YashanDB",
    "productName": "YashanDB 知识中心"
  },
  "modules": [],
  "workspaces": [],
  "domain": {
    "id": "yashandb",
    "version": "1.0.0",
    "manifestRef": "contracts/enterprise-profile/v1/fixtures/resources/domain.json"
  },
  "connectors": [],
  "agents": [],
  "skills": [],
  "prompts": [],
  "templates": [],
  "qualityRules": [],
  "logicalDirectories": [],
  "capabilities": [],
  "compatibility": {
    "defaultProfile": true,
    "legacyEntrypoints": ["/prompt-generator.html", "/pingcode-materials/"],
    "legacyApiPreserved": true,
    "entityTypeAliases": {}
  },
  "runtimeProjection": {
    "exposedBrandFields": ["platformName", "enterpriseName", "productName"],
    "exposedCapabilityFields": ["id", "enabled"]
  }
}
